Erciyes Universitesi,Spor Bilimleri Fakultesi,Antrenorluk Egitimi Bolumu,Arastirma Gorevlisi Fatih Komurcu
Erciyes Universitesi,Tip Fakultesi,Cerrahi Tip Bilimleri Bolumu,Arastirma Gorevlisi Fatih Yavuz
Erciyes Universitesi,Tip Fakultesi,Temel Tip Bilimleri Bolumu,Arastirma Gorevlisi Fatih Mehmet Koca
Erciyes Universitesi,Dis Hekimligi Fakultesi,Klinik Bilimler Bolumu,Arastirma Gorevlisi Fatma Cavdar Boyraz
Erciyes Universitesi,Dis Hekimligi Fakultesi,Klinik Bilimler Bolumu,Arastirma Gorevlisi Fatma Dilek
Erciyes Universitesi,Dis Hekimligi Fakultesi,Klinik Bilimler Bolumu,Arastirma Gorevlisi Fatma Gurbuz
Erciyes Universitesi,Dis Hekimligi Fakultesi,Klinik Bilimler Bolumu,Arastirma Gorevlisi Fatma Kizikli Isik
Erciyes Universitesi,Hukuk Fakultesi,Kamu Hukuku Bolumu,Arastirma Gorevlisi Fatma Otkan
Erciyes Universitesi,Tip Fakultesi,Dahili Tip Bilimleri Bolumu,Arastirma Gorevlisi Fatma Ozdemir
Erciyes Universitesi,Muhendislik Fakultesi,Biyomedikal Muhendisligi Bolumu,Arastirma Gorevlisi Fatma Uysal Ciloglu
Erciyes Universitesi,Dis Hekimligi Fakultesi,Klinik Bilimler Bolumu,Arastirma Gorevlisi Fatma Berra Iyibilgin
Erciyes Universitesi,Dis Hekimligi Fakultesi,Klinik Bilimler Bolumu,Arastirma Gorevlisi Fatma Beyza Kocyigit
Erciyes Universitesi,Tip Fakultesi,Dahili Tip Bilimleri Bolumu,Arastirma Gorevlisi Fatma Nur Aba
Erciyes Universitesi,Ziraat Fakultesi,Toprak Bilimi Ve Bitki Besleme Bolumu,Arastirma Gorevlisi Fatma Nur Kilic
Erciyes Universitesi,Tip Fakultesi,Cerrahi Tip Bilimleri Bolumu,Arastirma Gorevlisi Fatma Sena Topcu
Erciyes Universitesi,Dis Hekimligi Fakultesi,Klinik Bilimler Bolumu,Arastirma Gorevlisi Fatma Zeliha Sahin
Erciyes Universitesi,Mimarlik Fakultesi,Mimarlik Bolumu,Arastirma Gorevlisi Fazil Akdag
Erciyes Universitesi,Dis Hekimligi Fakultesi,Klinik Bilimler Bolumu,Arastirma Gorevlisi Fehime Akyildiz
Erciyes Universitesi,Muhendislik Fakultesi,Insaat Muhendisligi Bolumu,Arastirma Gorevlisi Feride Maide Mizrakci
Erciyes Universitesi,Dis Hekimligi Fakultesi,Klinik Bilimler Bolumu,Arastirma Gorevlisi Feridenur Acikgoz
Erciyes Universitesi,Saglik Bilimleri Fakultesi,Dil Ve Konusma Terapisi Bolumu,Arastirma Gorevlisi Ferit Uzun
Erciyes Universitesi,Iletisim Fakultesi,Gazetecilik Bolumu,Arastirma Gorevlisi Feyza Cevik
Erciyes Universitesi,Dis Hekimligi Fakultesi,Klinik Bilimler Bolumu,Arastirma Gorevlisi Feyza Nur Altan
Erciyes Universitesi,Tip Fakultesi,Cerrahi Tip Bilimleri Bolumu,Arastirma Gorevlisi Fidan Elif Baktir Okcesiz
Erciyes Universitesi,Havacilik Ve Uzay Bilimleri Fakultesi,Ucak Govde Ve Motor Bakimi Bolumu,Arastirma Gorevlisi Figen Koklu
Erciyes Universitesi,Tip Fakultesi,Dahili Tip Bilimleri Bolumu,Arastirma Gorevlisi Filiz Mirac Simsek
Erciyes Universitesi,Muhendislik Fakultesi,Bilgisayar Muhendisligi Bolumu,Arastirma Gorevlisi Fuat Tore
Erciyes Universitesi,Mimarlik Fakultesi,Mimarlik Bolumu,Arastirma Gorevlisi Fulya Atarer
Erciyes Universitesi,Dis Hekimligi Fakultesi,Klinik Bilimler Bolumu,Arastirma Gorevlisi Furkan Akkilic
Erciyes Universitesi,Muhendislik Fakultesi,Yazilim Muhendisligi Bolumu,Arastirma Gorevlisi Furkan Bagirgan
Erciyes Universitesi,Dis Hekimligi Fakultesi,Klinik Bilimler Bolumu,Arastirma Gorevlisi Furkan Kilic
Erciyes Universitesi,Fen Fakultesi,Kimya Bolumu,Arastirma Gorevlisi Furkan Uzcan
Erciyes Universitesi,Tip Fakultesi,Dahili Tip Bilimleri Bolumu,Arastirma Gorevlisi Furkan Kazim Cesme
Erciyes Universitesi,Egitim Fakultesi,Turkce Ve Sosyal Bilimler Egitimi Bolumu,Arastirma Gorevlisi (unvan:docent) Galip Oner
Erciyes Universitesi,Veteriner Fakultesi,Klinik Oncesi Bilimleri Bolumu,Arastirma Gorevlisi Gamze Yetismis
Erciyes Universitesi,Tip Fakultesi,Cerrahi Tip Bilimleri Bolumu,Arastirma Gorevlisi Gizem Buyukince
Erciyes Universitesi,Muhendislik Fakultesi,Elektrik-elektronik Muhendisligi Bolumu,Arastirma Gorevlisi Gokcen Ozdemir
Erciyes Universitesi,Veteriner Fakultesi,Klinik Bilimler Bolumu,Arastirma Gorevlisi Gokcen Perk
Erciyes Universitesi,Dis Hekimligi Fakultesi,Klinik Bilimler Bolumu,Arastirma Gorevlisi Gokhan Kas
Erciyes Universitesi,Eczacilik Fakultesi,Temel Eczacilik Bilimleri Bolumu,Arastirma Gorevlisi Gokhan Sarp
Erciyes Universitesi,Dis Hekimligi Fakultesi,Klinik Bilimler Bolumu,Arastirma Gorevlisi Goknur Ozturk Uslu
Erciyes Universitesi,Veteriner Fakultesi,Klinik Oncesi Bilimleri Bolumu,Arastirma Gorevlisi Gorkem Ekebas
Erciyes Universitesi,Tip Fakultesi,Dahili Tip Bilimleri Bolumu,Arastirma Gorevlisi Gozde Diriksoy Catal
Erciyes Universitesi,Iktisadi Ve Idari Bilimler Fakultesi,Siyaset Bilimi Ve Kamu Yonetimi Bolumu,Arastirma Gorevlisi Gozde Kestellioglu
Erciyes Universitesi,Tip Fakultesi,Cerrahi Tip Bilimleri Bolumu,Arastirma Gorevlisi Gulden Sari
Erciyes Universitesi,Tip Fakultesi,Dahili Tip Bilimleri Bolumu,Arastirma Gorevlisi Gulhan Ozan Altas
Erciyes Universitesi,Muhendislik Fakultesi,Endustri Muhendisligi Bolumu,Arastirma Gorevlisi Gulhan Toga
Erciyes Universitesi,Edebiyat Fakultesi,Dogu Dilleri Ve Edebiyatlari Bolumu,Arastirma Gorevlisi Gulhanim Taskiran
Erciyes Universitesi,Edebiyat Fakultesi,Dogu Dilleri Ve Edebiyatlari Bolumu,Arastirma Gorevlisi Guliz Dogan
Erciyes Universitesi,Muhendislik Fakultesi,Elektrik-elektronik Muhendisligi Bolumu,Arastirma Gorevlisi Gulnur Yilmaz Bingol
Erciyes Universitesi,Saglik Bilimleri Fakultesi,Hemsirelik Bolumu,Arastirma Gorevlisi Gulseren Maras
Erciyes Universitesi,Dis Hekimligi Fakultesi,Klinik Bilimler Bolumu,Arastirma Gorevlisi Gulsevim Saritas
Erciyes Universitesi,Tip Fakultesi,Dahili Tip Bilimleri Bolumu,Arastirma Gorevlisi Gulsah Gunes
Erciyes Universitesi,Tip Fakultesi,Temel Tip Bilimleri Bolumu,Arastirma Gorevlisi Gunsu Aydin
Erciyes Universitesi,Egitim Fakultesi,Ozel Egitim Bolumu,Arastirma Gorevlisi Guzidenur Yolcu
Erciyes Universitesi,Muhendislik Fakultesi,Endustri Muhendisligi Bolumu,Arastirma Gorevlisi Habibe Irem Er
Erciyes Universitesi,Muhendislik Fakultesi,Makine Muhendisligi Bolumu,Arastirma Gorevlisi Hacer Merve Tacgun
Erciyes Universitesi,Ilahiyat Fakultesi,Felsefe Ve Din Bilimleri Bolumu,Arastirma Gorevlisi Hakan Tafran
Erciyes Universitesi,Egitim Fakultesi,Yabanci Diller Egitimi Bolumu,Arastirma Gorevlisi Hale Ortakoyluoglu
Erciyes Universitesi,Mimarlik Fakultesi,Mimarlik Bolumu,Arastirma Gorevlisi Halide Irem Erkan Kaya
Erciyes Universitesi,Saglik Bilimleri Fakultesi,Hemsirelik Bolumu,Arastirma Gorevlisi Halil Kalayci
Erciyes Universitesi,Dis Hekimligi Fakultesi,Klinik Bilimler Bolumu,Arastirma Gorevlisi Halime Cetiner
Erciyes Universitesi,Fen Fakultesi,Kimya Bolumu,Arastirma Gorevlisi Halis Karatas
Erciyes Universitesi,Tip Fakultesi,Dahili Tip Bilimleri Bolumu,Arastirma Gorevlisi Hamiyet Ozkan
Erciyes Universitesi,Eczacilik Fakultesi,Eczacilik Meslek Bilimleri Bolumu,Arastirma Gorevlisi Handan Deligoz
Erciyes Universitesi,Saglik Bilimleri Fakultesi,Hemsirelik Bolumu,Arastirma Gorevlisi Handan Topan
Erciyes Universitesi,Dis Hekimligi Fakultesi,Klinik Bilimler Bolumu,Arastirma Gorevlisi Hande Bahar Tas
Erciyes Universitesi,Tip Fakultesi,Dahili Tip Bilimleri Bolumu,Arastirma Gorevlisi Hanife Oguz
Erciyes Universitesi,Saglik Bilimleri Fakultesi,Hemsirelik Bolumu,Arastirma Gorevlisi Harun Ozbey
Erciyes Universitesi,Egitim Fakultesi,Egitim Bilimleri Bolumu,Arastirma Gorevlisi Hasan Ayyildiz
Erciyes Universitesi,Ziraat Fakultesi,Bahce Bitkileri Bolumu,Arastirma Gorevlisi Hasan Talha Unsal
Erciyes Universitesi,Dis Hekimligi Fakultesi,Klinik Bilimler Bolumu,Arastirma Gorevlisi Hatice Sarioglu
Erciyes Universitesi,Tip Fakultesi,Dahili Tip Bilimleri Bolumu,Arastirma Gorevlisi Hatice Beyza Unal
Erciyes Universitesi,Tip Fakultesi,Dahili Tip Bilimleri Bolumu,Arastirma Gorevlisi Hatice Gozde Demir
Erciyes Universitesi,Dis Hekimligi Fakultesi,Klinik Bilimler Bolumu,Arastirma Gorevlisi Hatice Kubra Arsal
Erciyes Universitesi,Muhendislik Fakultesi,Bilgisayar Muhendisligi Bolumu,Arastirma Gorevlisi Hayri Ozturk
Erciyes Universitesi,Ilahiyat Fakultesi,Felsefe Ve Din Bilimleri Bolumu,Arastirma Gorevlisi Hayriye Gencel Sozen
Erciyes Universitesi,Veteriner Fakultesi,Klinik Bilimler Bolumu,Arastirma Gorevlisi Hazal Aysin Aslan
Erciyes Universitesi,Saglik Bilimleri Fakultesi,Hemsirelik Bolumu,Arastirma Gorevlisi Hilal Kahraman
Erciyes Universitesi,Dis Hekimligi Fakultesi,Klinik Bilimler Bolumu,Arastirma Gorevlisi Hilal Sert
Erciyes Universitesi,Edebiyat Fakultesi,Dogu Dilleri Ve Edebiyatlari Bolumu,Arastirma Gorevlisi Hulya Deveci
Erciyes Universitesi,Tip Fakultesi,Dahili Tip Bilimleri Bolumu,Arastirma Gorevlisi Humeyra Nur Ekinci
Erciyes Universitesi,Tip Fakultesi,Dahili Tip Bilimleri Bolumu,Arastirma Gorevlisi Huseyin Kaplan
Erciyes Universitesi,Muhendislik Fakultesi,Makine Muhendisligi Bolumu,Arastirma Gorevlisi Huseyin Enes Fil
Erciyes Universitesi,Muhendislik Fakultesi,Insaat Muhendisligi Bolumu,Arastirma Gorevlisi Huseyin Hilmi Aslanbay
Erciyes Universitesi,Ziraat Fakultesi,Zootekni Bolumu,Arastirma Gorevlisi Huseyin Mert Yuksel
Erciyes Universitesi,Tip Fakultesi,Temel Tip Bilimleri Bolumu,Arastirma Gorevlisi Isil Tugce Turan
Erciyes Universitesi,Tip Fakultesi,Dahili Tip Bilimleri Bolumu,Arastirma Gorevlisi Ibrahim Mercan
Erciyes Universitesi,Dis Hekimligi Fakultesi,Klinik Bilimler Bolumu,Arastirma Gorevlisi Ibrahim Mert Erkan
Erciyes Universitesi,Dis Hekimligi Fakultesi,Klinik Bilimler Bolumu,Arastirma Gorevlisi Ikbal Erkaya
Erciyes Universitesi,Edebiyat Fakultesi,Dogu Dilleri Ve Edebiyatlari Bolumu,Arastirma Gorevlisi Ilhan Aslan
Erciyes Universitesi,Dis Hekimligi Fakultesi,Klinik Bilimler Bolumu,Arastirma Gorevlisi Ilke Manolya Ozdemir
Erciyes Universitesi,Saglik Bilimleri Fakultesi,Hemsirelik Bolumu,Arastirma Gorevlisi Ilker Yilmaz
Erciyes Universitesi,Dis Hekimligi Fakultesi,Klinik Bilimler Bolumu,Arastirma Gorevlisi Ilyas Posma
Erciyes Universitesi,Dis Hekimligi Fakultesi,Klinik Bilimler Bolumu,Arastirma Gorevlisi Ipek Eraslan Akyuz
Erciyes Universitesi,Hukuk Fakultesi,Ozel Hukuk Bolumu,Arastirma Gorevlisi Irem Nur Simsek
Erciyes Universitesi,Tip Fakultesi,Dahili Tip Bilimleri Bolumu,Arastirma Gorevlisi Ismail Duzgun
Erciyes Universitesi,Edebiyat Fakultesi,Sanat Tarihi Bolumu,Arastirma Gorevlisi Israfil Mutlu
Erciyes Universitesi,Muhendislik Fakultesi,Tekstil Muhendisligi Bolumu,Arastirma Gorevlisi Jan Sena Altinay
Erciyes Universitesi,Dis Hekimligi Fakultesi,Klinik Bilimler Bolumu,Arastirma Gorevlisi Kaan Ozturk
Erciyes Universitesi,Iletisim Fakultesi,"Radyo, Televizyon Ve Sinema Bolumu",Arastirma Gorevlisi Kadir Macit
Erciyes Universitesi,Dis Hekimligi Fakultesi,Klinik Bilimler Bolumu,Arastirma Gorevlisi Kadir Yilmaz
Erciyes Universitesi,Dis Hekimligi Fakultesi,Klinik Bilimler Bolumu,Arastirma Gorevlisi Kadir Kaan Umit
Erciyes Universitesi,Muhendislik Fakultesi,Elektrik-elektronik Muhendisligi Bolumu,Arastirma Gorevlisi Kadir Tugrul Bozkurt
Erciyes Universitesi,Havacilik Ve Uzay Bilimleri Fakultesi,Ucak Govde Ve Motor Bakimi Bolumu,Arastirma Gorevlisi Kamil Mutlu
Erciyes Universitesi,Dis Hekimligi Fakultesi,Klinik Bilimler Bolumu,Arastirma Gorevlisi Kemal Selcuk Yucel
Erciyes Universitesi,Eczacilik Fakultesi,Eczacilik Meslek Bilimleri Bolumu,Arastirma Gorevlisi Kerem Akbulut
Erciyes Universitesi,Tip Fakultesi,Cerrahi Tip Bilimleri Bolumu,Arastirma Gorevlisi Kubra Erdogan
Erciyes Universitesi,Tip Fakultesi,Temel Tip Bilimleri Bolumu,Arastirma Gorevlisi Kubra Aslan
Erciyes Universitesi,Dis Hekimligi Fakultesi,Klinik Bilimler Bolumu,Arastirma Gorevlisi Kubra Emanet
Erciyes Universitesi,Tip Fakultesi,Dahili Tip Bilimleri Bolumu,Arastirma Gorevlisi Kubra Karakas
Erciyes Universitesi,Saglik Bilimleri Fakultesi,Beslenme Ve Diyetetik Bolumu,Arastirma Gorevlisi Kubra Paslioglu
Erciyes Universitesi,Eczacilik Fakultesi,Eczacilik Meslek Bilimleri Bolumu,Arastirma Gorevlisi Kubra Uzun
Erciyes Universitesi,Veteriner Fakultesi,Klinik Oncesi Bilimleri Bolumu,Arastirma Gorevlisi Kubra Yagli
Erciyes Universitesi,Tip Fakultesi,Cerrahi Tip Bilimleri Bolumu,Arastirma Gorevlisi Kubra Zaidoglu
Erciyes Universitesi,Dis Hekimligi Fakultesi,Klinik Bilimler Bolumu,Arastirma Gorevlisi Kubra Nur Hekimoglu
Erciyes Universitesi,Veteriner Fakultesi,Gida Hijyeni Ve Teknolojisi Bolumu,Arastirma Gorevlisi Kursat Koskeroglu
Erciyes Universitesi,Egitim Fakultesi,Turkce Ve Sosyal Bilimler Egitimi Bolumu,Arastirma Gorevlisi Leyla Cimen
Erciyes Universitesi,Tip Fakultesi,Dahili Tip Bilimleri Bolumu,Arastirma Gorevlisi Leyla Dursun
Erciyes Universitesi,Eczacilik Fakultesi,Eczacilik Meslek Bilimleri Bolumu,Arastirma Gorevlisi Mahmud Sami Tuncel
Erciyes Universitesi,Dis Hekimligi Fakultesi,Klinik Bilimler Bolumu,Arastirma Gorevlisi Mehmet Cicek
Erciyes Universitesi,Muhendislik Fakultesi,Bilgisayar Muhendisligi Bolumu,Arastirma Gorevlisi Mehmet Elmaci
Erciyes Universitesi,Tip Fakultesi,Dahili Tip Bilimleri Bolumu,Arastirma Gorevlisi Mehmet Emeklioglu
Erciyes Universitesi,Eczacilik Fakultesi,Eczacilik Meslek Bilimleri Bolumu,Arastirma Gorevlisi Mehmet Murat
Erciyes Universitesi,Edebiyat Fakultesi,Dogu Dilleri Ve Edebiyatlari Bolumu,Arastirma Gorevlisi Mehmet Olcer
Erciyes Universitesi,Tip Fakultesi,Dahili Tip Bilimleri Bolumu,Arastirma Gorevlisi Mehmet Ozkaya
Erciyes Universitesi,Muhendislik Fakultesi,Makine Muhendisligi Bolumu,Arastirma Gorevlisi Mehmet Saritas
Erciyes Universitesi,Tip Fakultesi,Cerrahi Tip Bilimleri Bolumu,Arastirma Gorevlisi Mehmet Akif Akpinar
Erciyes Universitesi,Tip Fakultesi,Temel Tip Bilimleri Bolumu,Arastirma Gorevlisi Mehmet Akif Tasyapan
Erciyes Universitesi,Tip Fakultesi,Dahili Tip Bilimleri Bolumu,Arastirma Gorevlisi Mehmet Behaeddin Karabulut
Erciyes Universitesi,Tip Fakultesi,Cerrahi Tip Bilimleri Bolumu,Arastirma Gorevlisi Mehmet Berat Erturhan
Erciyes Universitesi,Tip Fakultesi,Cerrahi Tip Bilimleri Bolumu,Arastirma Gorevlisi Mehmet Can Kaya
Erciyes Universitesi,Guzel Sanatlar Fakultesi,Gorsel Iletisim Tasarimi Bolumu,Arastirma Gorevlisi Mehmet Emin Aykurt
Erciyes Universitesi,Tip Fakultesi,Cerrahi Tip Bilimleri Bolumu,Arastirma Gorevlisi Mehmet Furkan Kesici
Erciyes Universitesi,Dis Hekimligi Fakultesi,Klinik Bilimler Bolumu,Arastirma Gorevlisi Mehmet Melih Dasdelen
Erciyes Universitesi,Iktisadi Ve Idari Bilimler Fakultesi,Uluslararasi Iliskiler Bolumu,Arastirma Gorevlisi Mehmet Ozan Kasapoglu
Erciyes Universitesi,Edebiyat Fakultesi,Sosyoloji Bolumu,Arastirma Gorevlisi Melek Akgun
Erciyes Universitesi,Tip Fakultesi,Dahili Tip Bilimleri Bolumu,Arastirma Gorevlisi Melih Kiziltepe
Erciyes Universitesi,Tip Fakultesi,Dahili Tip Bilimleri Bolumu,Arastirma Gorevlisi Melike Golbasi
Erciyes Universitesi,Ziraat Fakultesi,Tarla Bitkileri Bolumu,Arastirma Gorevlisi Melike Incetekin
Erciyes Universitesi,Mimarlik Fakultesi,Mimarlik Bolumu,Arastirma Gorevlisi Meliksah Koca
Erciyes Universitesi,Dis Hekimligi Fakultesi,Klinik Bilimler Bolumu,Arastirma Gorevlisi Melis Cakar
Erciyes Universitesi,Muhendislik Fakultesi,Biyomedikal Muhendisligi Bolumu,Arastirma Gorevlisi Melis Tokmak
Erciyes Universitesi,Tip Fakultesi,Dahili Tip Bilimleri Bolumu,Arastirma Gorevlisi Melisa Bakis
Erciyes Universitesi,Dis Hekimligi Fakultesi,Klinik Bilimler Bolumu,Arastirma Gorevlisi Melisa Oya Acar
Erciyes Universitesi,Tip Fakultesi,Dahili Tip Bilimleri Bolumu,Arastirma Gorevlisi Meltem Findikgil
Erciyes Universitesi,Tip Fakultesi,Dahili Tip Bilimleri Bolumu,Arastirma Gorevlisi Meltem Guman
Erciyes Universitesi,Tip Fakultesi,Temel Tip Bilimleri Bolumu,Arastirma Gorevlisi Meltem Sonmez
Erciyes Universitesi,Iletisim Fakultesi,Gazetecilik Bolumu,Arastirma Gorevlisi (unvan:docent) Meltem Sahin Hassan
Erciyes Universitesi,Mimarlik Fakultesi,Mimarlik Bolumu,Arastirma Gorevlisi Meltem Ulu
Erciyes Universitesi,Muhendislik Fakultesi,Mekatronik Muhendisligi Bolumu,Arastirma Gorevlisi Memduh Suveren
Erciyes Universitesi,Dis Hekimligi Fakultesi,Klinik Bilimler Bolumu,Arastirma Gorevlisi Mert Arslan
Erciyes Universitesi,Dis Hekimligi Fakultesi,Klinik Bilimler Bolumu,Arastirma Gorevlisi Mert Kilincay
Erciyes Universitesi,Dis Hekimligi Fakultesi,Klinik Bilimler Bolumu,Arastirma Gorevlisi Mert Kolayli
Erciyes Universitesi,Dis Hekimligi Fakultesi,Klinik Bilimler Bolumu,Arastirma Gorevlisi Mert Sahin
Erciyes Universitesi,Muhendislik Fakultesi,Enerji Sistemleri Muhendisligi Bolumu,Arastirma Gorevlisi Mert Tas
Erciyes Universitesi,Tip Fakultesi,Cerrahi Tip Bilimleri Bolumu,Arastirma Gorevlisi Mert Turgul
Erciyes Universitesi,Dis Hekimligi Fakultesi,Klinik Bilimler Bolumu,Arastirma Gorevlisi Mertcan Kurt
Erciyes Universitesi,Muhendislik Fakultesi,Insaat Muhendisligi Bolumu,Arastirma Gorevlisi Mertcan Yilmaz
Erciyes Universitesi,Dis Hekimligi Fakultesi,Klinik Bilimler Bolumu,Arastirma Gorevlisi Merva Guneyli
Erciyes Universitesi,Dis Hekimligi Fakultesi,Klinik Bilimler Bolumu,Arastirma Gorevlisi Merve Ak
Erciyes Universitesi,Dis Hekimligi Fakultesi,Klinik Bilimler Bolumu,Arastirma Gorevlisi Merve Boyuk
Erciyes Universitesi,Hukuk Fakultesi,Ozel Hukuk Bolumu,Arastirma Gorevlisi Merve Caglak Melez
Erciyes Universitesi,Saglik Bilimleri Fakultesi,Beslenme Ve Diyetetik Bolumu,Arastirma Gorevlisi Merve Capas
Erciyes Universitesi,Dis Hekimligi Fakultesi,Klinik Bilimler Bolumu,Arastirma Gorevlisi Merve Edik
Erciyes Universitesi,Tip Fakultesi,Cerrahi Tip Bilimleri Bolumu,Arastirma Gorevlisi Merve Ergun Yildiz
Erciyes Universitesi,Tip Fakultesi,Temel Tip Bilimleri Bolumu,Arastirma Gorevlisi Merve Erturk Melez
Erciyes Universitesi,Dis Hekimligi Fakultesi,Klinik Bilimler Bolumu,Arastirma Gorevlisi Merve Kepezkaya
Erciyes Universitesi,Mimarlik Fakultesi,Sehir Ve Bolge Planlama Bolumu,Arastirma Gorevlisi Merve Kocak Gungor
Erciyes Universitesi,Tip Fakultesi,Dahili Tip Bilimleri Bolumu,Arastirma Gorevlisi Merve Ozkan
Erciyes Universitesi,Tip Fakultesi,Dahili Tip Bilimleri Bolumu,Arastirma Gorevlisi Merve Sancar Yetikcan
Erciyes Universitesi,Eczacilik Fakultesi,Eczacilik Meslek Bilimleri Bolumu,Arastirma Gorevlisi Merve Yildirim
Erciyes Universitesi,Fen Fakultesi,Biyoloji Bolumu,Arastirma Gorevlisi Merve Yigit
Erciyes Universitesi,Dis Hekimligi Fakultesi,Klinik Bilimler Bolumu,Arastirma Gorevlisi Meryem Guman
Erciyes Universitesi,Dis Hekimligi Fakultesi,Klinik Bilimler Bolumu,Arastirma Gorevlisi Meryem Kaygisiz Yigit
Erciyes Universitesi,Veteriner Fakultesi,Klinik Oncesi Bilimleri Bolumu,Arastirma Gorevlisi Metin Celik
Erciyes Universitesi,Havacilik Ve Uzay Bilimleri Fakultesi,Havacilik Yonetimi Bolumu,Arastirma Gorevlisi Mevlut Uzulmez
Erciyes Universitesi,Iktisadi Ve Idari Bilimler Fakultesi,Maliye Bolumu,Arastirma Gorevlisi Mine Yalcin
Erciyes Universitesi,Hukuk Fakultesi,Kamu Hukuku Bolumu,Arastirma Gorevlisi Miray Ozbek
Erciyes Universitesi,Fen Fakultesi,Biyoloji Bolumu,Arastirma Gorevlisi Mithat Gullu
Erciyes Universitesi,Tip Fakultesi,Temel Tip Bilimleri Bolumu,Arastirma Gorevlisi Muazzez Derya Andeden
Erciyes Universitesi,Ilahiyat Fakultesi,Temel Islam Bilimleri Bolumu,Arastirma Gorevlisi Muhammed Cinar
Erciyes Universitesi,Muhendislik Fakultesi,Enerji Sistemleri Muhendisligi Bolumu,Arastirma Gorevlisi Muhammed Hatem
Erciyes Universitesi,Tip Fakultesi,Dahili Tip Bilimleri Bolumu,Arastirma Gorevlisi Muhammed Kucuk
Erciyes Universitesi,Tip Fakultesi,Cerrahi Tip Bilimleri Bolumu,Arastirma Gorevlisi Muhammed Ali Tomris
Erciyes Universitesi,Dis Hekimligi Fakultesi,Klinik Bilimler Bolumu,Arastirma Gorevlisi Muhammed Emre Emek
Erciyes Universitesi,Hukuk Fakultesi,Kamu Hukuku Bolumu,Arastirma Gorevlisi Muhammed Esat Emek
Erciyes Universitesi,Iktisadi Ve Idari Bilimler Fakultesi,Iktisat Bolumu,Arastirma Gorevlisi Muhammed Ikbal Durmus
Erciyes Universitesi,Havacilik Ve Uzay Bilimleri Fakultesi,Ucak Govde Ve Motor Bakimi Bolumu,Arastirma Gorevlisi Muhammed Ikbal Kara
Erciyes Universitesi,Tip Fakultesi,Dahili Tip Bilimleri Bolumu,Arastirma Gorevlisi Muhammed Musa Onem
Erciyes Universitesi,Tip Fakultesi,Cerrahi Tip Bilimleri Bolumu,Arastirma Gorevlisi Muhammed Taha Uludag
Erciyes Universitesi,Tip Fakultesi,Cerrahi Tip Bilimleri Bolumu,Arastirma Gorevlisi Muhammed Yasar Ayyildiz
Erciyes Universitesi,Tip Fakultesi,Dahili Tip Bilimleri Bolumu,Arastirma Gorevlisi Muhammet Cengiz
Erciyes Universitesi,Dis Hekimligi Fakultesi,Klinik Bilimler Bolumu,Arastirma Gorevlisi Muhammet Disli
Erciyes Universitesi,Edebiyat Fakultesi,Turk Dili Ve Edebiyati Bolumu,Arastirma Gorevlisi Muhammet Kaya
Erciyes Universitesi,Tip Fakultesi,Cerrahi Tip Bilimleri Bolumu,Arastirma Gorevlisi Muhammet Sehit Karmaz
Erciyes Universitesi,Ilahiyat Fakultesi,Islam Tarihi Ve Sanatlari Bolumu,Arastirma Gorevlisi Muhammet Tayyip Dogan
Erciyes Universitesi,Veteriner Fakultesi,Gida Hijyeni Ve Teknolojisi Bolumu,Arastirma Gorevlisi Mukaddes Barel
Erciyes Universitesi,Fen Fakultesi,Fizik Bolumu,Arastirma Gorevlisi Murat Balci
Erciyes Universitesi,Muhendislik Fakultesi,Enerji Sistemleri Muhendisligi Bolumu,Arastirma Gorevlisi Murat Kisti
Erciyes Universitesi,Iktisadi Ve Idari Bilimler Fakultesi,Isletme Bolumu,Arastirma Gorevlisi Murat Ruhlusarac
Erciyes Universitesi,Muhendislik Fakultesi,Elektrik-elektronik Muhendisligi Bolumu,Arastirma Gorevlisi Murat Emre Erkoc
Erciyes Universitesi,Dis Hekimligi Fakultesi,Klinik Bilimler Bolumu,Arastirma Gorevlisi Musa Goksu
Erciyes Universitesi,Dis Hekimligi Fakultesi,Klinik Bilimler Bolumu,Arastirma Gorevlisi Musa Burhan Kucuksen
Erciyes Universitesi,Spor Bilimleri Fakultesi,Spor Yoneticiligi Bolumu,Arastirma Gorevlisi Mustafa Aktop
Erciyes Universitesi,Tip Fakultesi,Dahili Tip Bilimleri Bolumu,Arastirma Gorevlisi Mustafa Alkan
Erciyes Universitesi,Dis Hekimligi Fakultesi,Klinik Bilimler Bolumu,Arastirma Gorevlisi Mustafa Arginc
Erciyes Universitesi,Tip Fakultesi,Cerrahi Tip Bilimleri Bolumu,Arastirma Gorevlisi Mustafa Birkin
Erciyes Universitesi,Edebiyat Fakultesi,Turk Dili Ve Edebiyati Bolumu,Arastirma Gorevlisi Mustafa Cengiz
Erciyes Universitesi,Tip Fakultesi,Dahili Tip Bilimleri Bolumu,Arastirma Gorevlisi Mustafa Caliskan
Erciyes Universitesi,Iletisim Fakultesi,Gazetecilik Bolumu,Arastirma Gorevlisi Mustafa Cegindir
Erciyes Universitesi,Dis Hekimligi Fakultesi,Klinik Bilimler Bolumu,Arastirma Gorevlisi Mustafa Duranoglu
Erciyes Universitesi,Muhendislik Fakultesi,Elektrik-elektronik Muhendisligi Bolumu,Arastirma Gorevlisi Mustafa Kirlar
Erciyes Universitesi,Tip Fakultesi,Dahili Tip Bilimleri Bolumu,Arastirma Gorevlisi Mustafa Levent
Erciyes Universitesi,Ziraat Fakultesi,Zootekni Bolumu,Arastirma Gorevlisi Mustafa Ozdemir
Erciyes Universitesi,Tip Fakultesi,Cerrahi Tip Bilimleri Bolumu,Arastirma Gorevlisi Mustafa Ozdemir
Erciyes Universitesi,Tip Fakultesi,Dahili Tip Bilimleri Bolumu,Arastirma Gorevlisi Mustafa Sahan
Erciyes Universitesi,Tip Fakultesi,Cerrahi Tip Bilimleri Bolumu,Arastirma Gorevlisi Mustafa Yildiz
Erciyes Universitesi,Turizm Fakultesi,Turizm Isletmeciligi Bolumu,Arastirma Gorevlisi Mustafa Yilmaz
Erciyes Universitesi,Tip Fakultesi,Dahili Tip Bilimleri Bolumu,Arastirma Gorevlisi Mustafa Alperen Aydeniz
Erciyes Universitesi,Ziraat Fakultesi,Biyosistem Muhendisligi Bolumu,Arastirma Gorevlisi Mustafa Arif Timocin
Erciyes Universitesi,Tip Fakultesi,Dahili Tip Bilimleri Bolumu,Arastirma Gorevlisi Mustafa Savtekin Odabas
Erciyes Universitesi,Fen Fakultesi,Astronomi Ve Uzay Bilimleri Bolumu,Arastirma Gorevlisi Mustafa Turan Saglam
Erciyes Universitesi,Dis Hekimligi Fakultesi,Klinik Bilimler Bolumu,Arastirma Gorevlisi Muzaffer Firat
Erciyes Universitesi,Tip Fakultesi,Dahili Tip Bilimleri Bolumu,Arastirma Gorevlisi Mucahid Besnek
Erciyes Universitesi,Iktisadi Ve Idari Bilimler Fakultesi,Uluslararasi Iliskiler Bolumu,Arastirma Gorevlisi Mucahid Gurbuz
Erciyes Universitesi,Muhendislik Fakultesi,Insaat Muhendisligi Bolumu,Arastirma Gorevlisi Mucella Ilkentapar
Erciyes Universitesi,Dis Hekimligi Fakultesi,Klinik Bilimler Bolumu,Arastirma Gorevlisi Muge Hastekkesin
Erciyes Universitesi,Egitim Fakultesi,Egitim Bilimleri Bolumu,Arastirma Gorevlisi Naime Elcan Kaynak
Erciyes Universitesi,Turizm Fakultesi,Turizm Rehberligi Bolumu,Arastirma Gorevlisi Nazli Aysin Ornek
Erciyes Universitesi,Tip Fakultesi,Dahili Tip Bilimleri Bolumu,Arastirma Gorevlisi Nazli Sultan Ozsoy
Erciyes Universitesi,Edebiyat Fakultesi,Tarih Bolumu,Arastirma Gorevlisi Nebil Karaduman
Erciyes Universitesi,Iletisim Fakultesi,Halkla Iliskiler Ve Tanitim Bolumu,Arastirma Gorevlisi Nedim Karaduman
Erciyes Universitesi,Tip Fakultesi,Dahili Tip Bilimleri Bolumu,Arastirma Gorevlisi Nesibe Taser Kanat
Erciyes Universitesi,Edebiyat Fakultesi,Tarih Bolumu,Arastirma Gorevlisi Neslihan Demir Bedir
Erciyes Universitesi,Tip Fakultesi,Dahili Tip Bilimleri Bolumu,Arastirma Gorevlisi Neslihan Gunduz
Erciyes Universitesi,Saglik Bilimleri Enstitusu,,Arastirma Gorevlisi Neslihan Sungur
Erciyes Universitesi,Ilahiyat Fakultesi,Temel Islam Bilimleri Bolumu,Arastirma Gorevlisi Nesrin Kay
Erciyes Universitesi,Tip Fakultesi,Dahili Tip Bilimleri Bolumu,Arastirma Gorevlisi Neset Ali Savas
Erciyes Universitesi,Dis Hekimligi Fakultesi,Klinik Bilimler Bolumu,Arastirma Gorevlisi Nihal Senol
Erciyes Universitesi,Muhendislik Fakultesi,Harita Muhendisligi Bolumu,Arastirma Gorevlisi Nihal Tekin Unluturk
Erciyes Universitesi,Tip Fakultesi,Temel Tip Bilimleri Bolumu,Arastirma Gorevlisi Nihal Toy
Erciyes Universitesi,Edebiyat Fakultesi,Dogu Dilleri Ve Edebiyatlari Bolumu,Arastirma Gorevlisi Nihan Atli Usta
Erciyes Universitesi,Edebiyat Fakultesi,Dogu Dilleri Ve Edebiyatlari Bolumu,Arastirma Gorevlisi Nihan Karakus Harmanci
Erciyes Universitesi,Dis Hekimligi Fakultesi,Klinik Bilimler Bolumu,Arastirma Gorevlisi Nihat Ertane
Erciyes Universitesi,Dis Hekimligi Fakultesi,Klinik Bilimler Bolumu,Arastirma Gorevlisi Nimet Ceren Kilincarslan
Erciyes Universitesi,Eczacilik Fakultesi,Eczacilik Meslek Bilimleri Bolumu,Arastirma Gorevlisi Nuh Mehmet Bozkurt
Erciyes Universitesi,Hukuk Fakultesi,Kamu Hukuku Bolumu,Arastirma Gorevlisi Numan Dogan
